{
  "id": "urn:aichain:profile:supply-chain",
  "version": "0.4.0-alpha",
  "subjectKinds": [
    "core:artifact",
    "core:agent",
    "core:service"
  ],
  "requiredEvidence": [
    "supply:materials",
    "supply:process",
    "supply:product"
  ],
  "requireStream": false,
  "requireObservation": false,
  "specificationDigest": "0x237e51c5562e10fc17bba037021e3695bab1b7a9a5fc4d50f47471018af7cddb"
}
